[
  {
    "schema_version": 1,
    "identity": {"canonical_id": "openai/gpt-5.6", "display_name": "GPT-5.6", "maker": "openai", "family": "gpt", "generation": "5.6", "variant": "Sol"},
    "capabilities": {"reasoning": true, "vision": true, "tools": true, "structured_output": true},
    "route": {"provider": "openai-codex", "model_id": "gpt-5.6-sol", "direct": true, "access": "subscription"},
    "visual": {"maker_mark": "openai", "accent": "#B8FF3D", "fallback_monogram": "OA"},
    "provenance": {"source": "design-example", "source_url": null, "observed_at": null, "confidence": "provisional"}
  },
  {
    "schema_version": 1,
    "identity": {"canonical_id": "anthropic/claude-sonnet-5", "display_name": "Claude Sonnet 5", "maker": "anthropic", "family": "claude", "generation": "5", "variant": "Sonnet"},
    "capabilities": {"reasoning": true, "vision": true, "tools": true, "structured_output": true},
    "route": {"provider": "openrouter", "model_id": "anthropic/claude-sonnet-5", "direct": false, "access": "paid"},
    "visual": {"maker_mark": "anthropic", "accent": "#FFCB66", "fallback_monogram": "AN"},
    "provenance": {"source": "design-example", "source_url": null, "observed_at": null, "confidence": "provisional"}
  },
  {
    "schema_version": 1,
    "identity": {"canonical_id": "google/gemini-3.1-flash", "display_name": "Gemini 3.1 Flash", "maker": "google", "family": "gemini", "generation": "3.1", "variant": "Flash"},
    "capabilities": {"reasoning": true, "vision": true, "tools": true, "audio": true},
    "route": {"provider": "google", "model_id": "gemini-3.1-flash", "direct": true, "access": "paid"},
    "visual": {"maker_mark": "google", "accent": "#6DE1FF", "fallback_monogram": "GO"},
    "provenance": {"source": "design-example", "source_url": null, "observed_at": null, "confidence": "provisional"}
  }
]
